{
  "eventId": "9a1b2c3d-4e5f-4a6b-8c7d-0e1f2a3b4c5d",
  "eventType": "ScheduledReportReady",
  "occurredAt": "2026-10-05T06:00:04Z",
  "producer": "Reports",
  "schemaVersion": "1.0.0",
  "correlationId": "c2d3e4f5-a6b7-4c8d-9e0f-1a2b3c4d5e6f",
  "recipientSub": "5f2c8e7a-1b3d-4c6e-9f0a-8b7c6d5e4f32",
  "payload": {
    "subscriptionId": "e1f2a3b4-c5d6-4e7f-8a9b-0c1d2e3f4a5b",
    "snapshotId": "f0e1d2c3-b4a5-4968-8776-655443322110",
    "reportId": "R-06",
    "dataAsOf": "2026-10-05T05:00:00Z",
    "viewPath": "/snapshots/f0e1d2c3-b4a5-4968-8776-655443322110"
  }
}
